{
  "schemaVersion": 2,
  "notes": [
    "全年齢五軸再採点（2026-06-02）— 睡眠・覚醒軸を採用",
    "シナリオ内部観点: 空間/心理・一貫性・ギミック機能・導入/転換の独自性",
    "比較: michikusa（★10）— 満足度・総合★10"
  ],
  "scores": {
    "immersion": 9.0,
    "scenario": 9.0,
    "pleasure": 9.3,
    "acoustic": 9.0,
    "satisfaction": 10.0
  },
  "radarAxisLabels": {
    "immersion": "没入度",
    "scenario": "シナリオ",
    "pleasure": "睡眠・覚醒",
    "acoustic": "音響",
    "satisfaction": "満足度"
  },
  "workName": "死にたがり。～純愛メイドと壊れかけのあなた～【CV.浅木ゆめみ】"
}
